{"computedBinding":{"computedBindingId":"binding:inspection","computedDestinationAnalysis":"analysis:proof","computedDestinationFingerprint":"6586b256bb8f11ebda7cc726fd906ca16751a7eec3595a745376ea574978b26b","computedDestinationId":"document:registration","computedDestinationInput":"input:rebuttal","computedDestinationScope":{"scopeActor":"actor:iris","scopeContext":"context:warehouse"},"computedOriginalSources":[{"referenceSource":"source:note","referenceSpan":null},{"referenceSource":"source:note","referenceSpan":null}],"computedPolicy":{"mappingPolicy":"yuho.technical-status-to-proof/v1","mappingUnresolvedReason":"external_decision_pending"},"computedRationale":"Author explicitly admits this named technical result for the synthetic destination input; no legal proof or rebuttal adequacy finding.","computedSourceAnalysis":"analysis:typed","computedSourceDocument":"document:inspection","computedSourceExpression":"expr:inspection","computedSourceScope":{"scopeActor":"actor:iris","scopeContext":"context:warehouse"},"computedSourceSnapshot":"c512531277437eb6b3fac0d536e19a6834399f3b96e5083c0aced7b301defd10"},"computedDestination":{"destinationAnalysis":"analysis:proof","destinationPresumption":{"presumptionContext":["Synthetic route; technical rebuttal does not determine legal adequacy."],"presumptionDocumentFormat":"yuho.authoring/v0.4-experimental","presumptionDocumentId":"document:registration","presumptionProofDocument":{"documentAnalyses":[{"analysisAssessments":["assessment:input:trigger","assessment:input:knowledge"],"analysisId":"analysis:proof","analysisReferenceDate":"2026-10-21","analysisScope":{"scopeActor":"actor:iris","scopeContext":"context:warehouse"},"analysisTarget":"rule:dispatch"}],"documentAnnotations":[],"documentAssertions":[],"documentAssessments":[{"assessmentAssertions":[],"assessmentBasis":"assumption","assessmentClassification":{"kind":"proved"},"assessmentId":"assessment:input:trigger","assessmentInput":"input:trigger","assessmentIssuer":"Independent reviewer","assessmentOrigin":"synthetic_fixture","assessmentReason":"Independently supplied technical classification","assessmentScope":{"scopeActor":"actor:iris","scopeContext":"context:warehouse"},"assessmentSources":[{"referenceSource":"source:note","referenceSpan":null}]},{"assessmentAssertions":[],"assessmentBasis":"assumption","assessmentClassification":{"kind":"not_proved"},"assessmentId":"assessment:input:knowledge","assessmentInput":"input:knowledge","assessmentIssuer":"Independent reviewer","assessmentOrigin":"synthetic_fixture","assessmentReason":"Independently supplied technical classification","assessmentScope":{"scopeActor":"actor:iris","scopeContext":"context:warehouse"},"assessmentSources":[{"referenceSource":"source:note","referenceSpan":null}]}],"documentFormat":"yuho.authoring/v0.1-experimental","documentId":"document:registered-proof","documentLaw":{"lawEdges":[{"edgeFrom":"rule:dispatch","edgeId":"edge:knowledge","edgeKind":"requires","edgeTo":"input:knowledge"}],"lawId":"law:registered","lawNodes":[{"nodeCitation":null,"nodeId":"rule:dispatch","nodeKind":"rule","nodeLabel":"rule:dispatch","nodeQuotation":null,"nodeSources":[{"referenceSource":"source:note","referenceSpan":null}]},{"nodeCitation":null,"nodeId":"input:knowledge","nodeKind":"input","nodeLabel":"input:knowledge","nodeQuotation":null,"nodeSources":[{"referenceSource":"source:note","referenceSpan":null}]},{"nodeCitation":null,"nodeId":"input:trigger","nodeKind":"input","nodeLabel":"input:trigger","nodeQuotation":null,"nodeSources":[{"referenceSource":"source:note","referenceSpan":null}]},{"nodeCitation":null,"nodeId":"input:rebuttal","nodeKind":"input","nodeLabel":"input:rebuttal","nodeQuotation":null,"nodeSources":[{"referenceSource":"source:note","referenceSpan":null}]}],"lawRevision":"review-1","lawScope":["Synthetic registered technical route"]},"documentPresentation":[],"documentRelationships":[],"documentSources":[{"sourceId":"source:note","sourceKind":"synthetic","sourceLocator":null,"sourceText":"Original destination dispatch note."}]},"presumptionRegistrations":[{"registeredAnalyses":["analysis:proof"],"registeredId":"registration:knowledge","registeredLabel":"Synthetic knowledge route","registeredRebuttal":{"registeredConditionId":"condition:rebuttal","registeredConditionKind":"leaf_effective","registeredConditionLeaf":"input:rebuttal","registeredConditionMembers":[],"registeredConditionSources":[{"referenceSource":"source:note","referenceSpan":null}]},"registeredSources":[{"referenceSource":"source:note","referenceSpan":null}],"registeredTarget":"input:knowledge","registeredTrigger":{"registeredConditionId":"condition:trigger","registeredConditionKind":"leaf_effective","registeredConditionLeaf":"input:trigger","registeredConditionMembers":[],"registeredConditionSources":[{"referenceSource":"source:note","referenceSpan":null}]}}]},"destinationProfile":"RegisteredPresumptionDerivations-v1","destinationProof":null},"computedDocumentFormat":"yuho.computed-input/v0.1-experimental","computedDocumentId":"workflow:inspection","computedTypedSource":{"typedAnalyses":[{"selectedTypedAssessments":["assessment:check"],"selectedTypedValues":["value:score","value:minimum"],"typedAnalysisId":"analysis:typed","typedAnalysisProposition":"proposition:ready","typedAnalysisRule":"rule:inspect","typedAnalysisScope":{"scopeActor":"actor:iris","scopeContext":"context:warehouse"}}],"typedAnnotations":[],"typedApplications":[{"applicationMeta":{"typedCitation":null,"typedId":"application:seal","typedLabel":"application:seal","typedSources":[{"referenceSource":"source:note","referenceSpan":null}]},"applicationTuple":{"tupleArguments":["actor:iris","resource:seal-a"],"tuplePredicate":"predicate:checked"}}],"typedAssessments":[{"assessedApplication":"application:seal","assessedTuple":{"tupleArguments":["actor:iris","resource:seal-a"],"tuplePredicate":"predicate:checked"},"typedAssertionRefs":[],"typedAssessmentMeta":{"typedCitation":null,"typedId":"assessment:check","typedLabel":"assessment:check","typedSources":[{"referenceSource":"source:note","referenceSpan":null}]},"typedAssessmentReason":"Independent initial check","typedAssessmentScope":{"scopeActor":"actor:iris","scopeContext":"context:warehouse"},"typedBasis":"assumption","typedClassification":{"tag":"TechnicalTrue"},"typedIssuer":"Independent reviewer","typedOrigin":"synthetic_fixture"}],"typedCaseAssertions":[],"typedDocumentFormat":"yuho.authoring/v0.3-experimental","typedDocumentId":"document:inspection","typedEntities":[{"entityMeta":{"typedCitation":null,"typedId":"actor:iris","typedLabel":"actor:iris","typedSources":[{"referenceSource":"source:note","referenceSpan":null}]},"entityNominalType":"type:actor"},{"entityMeta":{"typedCitation":null,"typedId":"actor:omar","typedLabel":"actor:omar","typedSources":[{"referenceSource":"source:note","referenceSpan":null}]},"entityNominalType":"type:actor"},{"entityMeta":{"typedCitation":null,"typedId":"resource:seal-a","typedLabel":"Seal","typedSources":[{"referenceSource":"source:note","referenceSpan":null}]},"entityNominalType":"type:seal"},{"entityMeta":{"typedCitation":null,"typedId":"resource:seal-b","typedLabel":"Seal","typedSources":[{"referenceSource":"source:note","referenceSpan":null}]},"entityNominalType":"type:seal"}],"typedEntityTypes":[{"entityTypeMeta":{"typedCitation":null,"typedId":"type:actor","typedLabel":"type:actor","typedSources":[{"referenceSource":"source:note","referenceSpan":null}]}},{"entityTypeMeta":{"typedCitation":null,"typedId":"type:seal","typedLabel":"type:seal","typedSources":[{"referenceSource":"source:note","referenceSpan":null}]}}],"typedExpressions":[{"expressionForm":{"tag":"TypedAll"},"expressionMeta":{"typedCitation":null,"typedId":"expr:inspection","typedLabel":"expr:inspection","typedSources":[{"referenceSource":"source:note","referenceSpan":null}]}},{"expressionForm":{"contents":"application:seal","tag":"GroundApplication"},"expressionMeta":{"typedCitation":null,"typedId":"expr:tuple","typedLabel":"expr:tuple","typedSources":[{"referenceSource":"source:note","referenceSpan":null}]}},{"expressionForm":{"contents":["gt","scalar:score","scalar:minimum"],"tag":"IntegerComparison"},"expressionMeta":{"typedCitation":null,"typedId":"expr:score","typedLabel":"expr:score","typedSources":[{"referenceSource":"source:note","referenceSpan":null}]}}],"typedLawId":"law:inspection","typedLawRevision":"review-1","typedLimitations":["Synthetic technical review only; no legal interpretation."],"typedLinks":[{"typedLinkFrom":"rule:inspect","typedLinkId":"link:body","typedLinkKind":"typed_body","typedLinkTo":"expr:inspection"},{"typedLinkFrom":"expr:inspection","typedLinkId":"link:tuple","typedLinkKind":"typed_member","typedLinkTo":"expr:tuple"},{"typedLinkFrom":"expr:inspection","typedLinkId":"link:score","typedLinkKind":"typed_member","typedLinkTo":"expr:score"}],"typedOriginalSources":[{"sourceId":"source:note","sourceKind":"synthetic","sourceLocator":null,"sourceText":"Original typed inspection note: seal checked."}],"typedPredicates":[{"predicateMeta":{"typedCitation":null,"typedId":"predicate:checked","typedLabel":"predicate:checked","typedSources":[{"referenceSource":"source:note","referenceSpan":null}]},"predicateRoles":[{"argumentRole":"inspector","argumentType":"type:actor"},{"argumentRole":"seal","argumentType":"type:seal"}]}],"typedPresentation":[],"typedPropositions":[{"propositionMeta":{"typedCitation":null,"typedId":"proposition:ready","typedLabel":"proposition:ready","typedSources":[{"referenceSource":"source:note","referenceSpan":null}]}}],"typedRules":[{"typedRuleConclusion":"proposition:ready","typedRuleMeta":{"typedCitation":null,"typedId":"rule:inspect","typedLabel":"rule:inspect","typedSources":[{"referenceSource":"source:note","referenceSpan":null}]}}],"typedScalars":[{"scalarDeclaredType":"integer","scalarMeta":{"typedCitation":null,"typedId":"scalar:score","typedLabel":"scalar:score","typedSources":[{"referenceSource":"sour